statement_id,profile_id,year,period,theme,summary,tone,youtube_id,youtube_link,
1,1,2025,Sebelum Pemilihan Timbalan Presiden PKR,Ekonomi Madani,"Rafizi menerangkan strategi kenaikan gaji dalam kerangka Ekonomi Madani dengan sasaran meningkatkan nisbah Pampasan kepada Pekerja (CE) daripada 33% kepada 45% menjelang 2033. Beliau menjelaskan pelaksanaan gaji progresif, kenaikan gaji minimum, dan pelaburan sektor nilai tinggi sebagai pemacu utama pertumbuhan gaji, sambil menekankan keperluan keseimbangan antara kenaikan gaji dan kestabilan pekerjaan formal.",Tegas,V001,https://youtu.be/7715zkAiC20?si=zAVep1GbLlMRH5d4,
2,1,2024,Semasa Pemilihan Timbalan Presiden PKR,Reformasi Parti,Rafizi menyeru agar integriti dan demokrasi dalam PKR terus dipertahankan walaupun berdepan manipulasi dan perebutan kuasa dalaman. Beliau kekal setia pada prinsip reformasi dan menyeru ahli menolak oportunisme dalam parti.,Neutral,V002,https://www.youtube.com/watch?v=r-E2dwkTWeU ,
3,1,2024,Selepas Tewas Timbalan Presiden PKR,Kebebasan Bersuara,Rafizi menyentuh isu pembakaran karikatur PM oleh pelajar sebagai simbol ekspresi. Beliau menekankan bahawa pemimpin tidak sepatutnya menghalang kritikan awam dan harus lebih terbuka terhadap suara anak muda. Beliau juga menegaskan pentingnya ruang dialog yang benar-benar tulen bagi memupuk pemikiran kritikal dalam kalangan generasi muda.,Rasional,V003,https://www.youtube.com/watch?v=fkaApyCOJnA,
4,1,2024,Selepas Letak Jawatan,Mandat & Reformasi,"Rafizi sah menyerahkan surat peletakan jawatan Menteri Ekonomi berkuat kuasa 17 Jun, kerana kekalahan dalam pemilihan Timbalan Presiden PKR melucut mandat rakyat. Beliau juga tekankan prinsip kebertanggungjawaban dan limpahan mandat rakyat — walaupun kekalahan dalam pemilihan dalaman. Beliau tegaskan bahawa usaha untuk menjadikan Malaysia negara berpendapatan tinggi tetap diteruskan, walaupun melalui kerja penjawat awam dan dasar yang dirangka. Beliau juga menyeru agar rakyat, penjawat awam, dan sektor swasta terus menyokong perjalanan ekonomi jangka panjang walaupun beliau tidak lagi dalam kabinet.",Rasional,V004,https://www.youtube.com/watch?v=p_idrXZpvr8,
5,1,2024,Umum,Ekonomi & Teknologi,"Rafizi bincangkan perancangan Malaysia untuk memperkukuh industri semikonduktor melalui pelaburan USD?250?juta dengan Arm, mempercepat peralihan daripada back?end kepada reka bentuk cip front?end, dan sasaran pertumbuhan KDNK serta penciptaan pekerjaan teknikal.",Teknikal,V005,https://youtu.be/mBV1sSv8w5w?si=mCEABubeUzenVRhY,
6,1,2024,Umum,Debat Ekonomi,"Debat ekonomi antara Rafizi dan Syahir membincangkan model ekonomi baharu Malaysia, isu struktur gaji, subsidi bersasar, hutang kerajaan, dan keperluan reformasi radikal. Kedua-dua pihak menekankan pentingnya integriti, kestabilan fiskal dan dialog politik matang untuk bina ekonomi berdaya tahan.",Neutral & Rasional,V006,https://www.youtube.com/watch?v=nwrVxmroAow,
7,1,2024,Umum,Tenaga & Perdagangan,"Menurut Rafizi, Malaysia menjangkakan pertumbuhan ekonomi 4.5% pada tahun 2024, disokong oleh ekonomi yang pelbagai seperti minyak sawit, semikonduktor dan tenaga. Kerajaan dengan majoriti besar kini melaksanakan reformasi seperti pengurangan subsidi, pelaburan besar dalam tenaga boleh baharu, dan pembangunan kemahiran tenaga kerja. Malaysia juga sedang mengukuhkan peranannya sebagai hab serantau tenaga boleh baharu serta menukar industri semikonduktor ke arah aktiviti nilai tinggi. Dasar latihan baharu turut diperkenalkan untuk menangani kekurangan tenaga mahir. Keadaan politik yang stabil membolehkan reformasi jangka panjang dilaksanakan dengan lebih konsisten dan berkesan.",Teknikal,V007,https://www.youtube.com/watch?v=DyYvdrs9t9o,
8,1,2024,Umum,Teknologi AI,"Rafizi umum kerjasama strategik Malaysia–Arm bagi ubah industri semikonduktor negara daripada pemasangan kepada reka bentuk litar bersepadu (IC). MoU ini bakal bangunkan 10,000 bakat teknologi tempatan dan pacu Malaysia sebagai hab teknologi berasaskan IP bernilai tinggi.",Teknikal,V008,https://www.youtube.com/watch?v=BIk7r3A_XA8,
